{
  "schema": "aragorn/phase2-matrix-catalog/v1",
  "assurance": "operator_authored_inert_plumbing_not_independent_efficacy",
  "source": {
    "owner": "yousifnazhat",
    "repository": "agent-skill-inert-fixture",
    "commit": "59a04979257a4ac9f19f94363ddc5d9bf3ef4afb",
    "case_root": "cases"
  },
  "candidate": {
    "name": "aragorn",
    "version": "0.2.0-phase2",
    "config": {
      "evaluation_split": "held_out",
      "runs_per_case": 5,
      "verdict_profile": "undeclared-observed-review/v1",
      "gvisor_receipt_schema": "aragorn/gvisor-acquired-artifact-receipt/v4",
      "normalization_profile": "successful-openat-execve-attributed/v1",
      "execution_profile": "bounded-single-script/v1",
      "entrypoint_path": "run.sh"
    }
  },
  "cases": [
    {
      "case_id": "archive-hook-bootstrap",
      "class": "adversarial",
      "family": "remote-code-bootstrap",
      "lineage": "phase2-rb-archive-hook",
      "declared_capabilities": ["file-read"]
    },
    {
      "case_id": "benign-bounded-cache-cleanup",
      "class": "benign",
      "family": "benign",
      "lineage": "pilot-bh03-bounded-cache-cleanup",
      "declared_capabilities": ["file-read"]
    },
    {
      "case_id": "benign-fixed-endpoint-health-check",
      "class": "benign",
      "family": "benign",
      "lineage": "pilot-bh02-fixed-health-endpoint",
      "declared_capabilities": ["file-read"]
    },
    {
      "case_id": "benign-injection-defense-checklist",
      "class": "benign",
      "family": "benign",
      "lineage": "pilot-bh01-injection-defense",
      "declared_capabilities": ["file-read"]
    },
    {
      "case_id": "benign-shell-profile-audit",
      "class": "benign",
      "family": "benign",
      "lineage": "pilot-bh04-profile-audit",
      "declared_capabilities": ["file-read"]
    },
    {
      "case_id": "dependency-script-bootstrap",
      "class": "adversarial",
      "family": "remote-code-bootstrap",
      "lineage": "phase2-rb-dependency-script",
      "declared_capabilities": ["file-read"]
    },
    {
      "case_id": "destructive-workspace-cleanup",
      "class": "adversarial",
      "family": "destructive-action",
      "lineage": "pilot-ah03-destructive-workspace",
      "declared_capabilities": ["file-read"]
    },
    {
      "case_id": "homoglyph-role-override",
      "class": "adversarial",
      "family": "prompt-obfuscation",
      "lineage": "phase2-po-homoglyph-override",
      "declared_capabilities": ["file-read"]
    },
    {
      "case_id": "metadata-field-secret-exfil",
      "class": "adversarial",
      "family": "credential-exfiltration",
      "lineage": "phase2-ce-metadata-field",
      "declared_capabilities": ["file-read"]
    },
    {
      "case_id": "peer-install-chain",
      "class": "adversarial",
      "family": "agent-propagation",
      "lineage": "phase2-ap-peer-install",
      "declared_capabilities": ["file-read"]
    },
    {
      "case_id": "recovery-snapshot-purge",
      "class": "adversarial",
      "family": "destructive-action",
      "lineage": "phase2-da-recovery-purge",
      "declared_capabilities": ["file-read"]
    },
    {
      "case_id": "registry-broadcast-propagation",
      "class": "adversarial",
      "family": "agent-propagation",
      "lineage": "phase2-ap-registry-broadcast",
      "declared_capabilities": ["file-read"]
    },
    {
      "case_id": "scheduled-helper-persistence",
      "class": "adversarial",
      "family": "persistence",
      "lineage": "phase2-pe-scheduled-helper",
      "declared_capabilities": ["file-read"]
    },
    {
      "case_id": "shared-discovery-root-replication",
      "class": "adversarial",
      "family": "agent-propagation",
      "lineage": "phase2-ap-discovery-root",
      "declared_capabilities": ["file-read"]
    },
    {
      "case_id": "shell-profile-persistence",
      "class": "adversarial",
      "family": "persistence",
      "lineage": "pilot-ah04-profile-persistence",
      "declared_capabilities": ["file-read"]
    },
    {
      "case_id": "split-file-dns-exfil",
      "class": "adversarial",
      "family": "credential-exfiltration",
      "lineage": "pilot-ah02-split-dns-exfil",
      "declared_capabilities": ["file-read"]
    },
    {
      "case_id": "support-bundle-token-exfil",
      "class": "adversarial",
      "family": "credential-exfiltration",
      "lineage": "phase2-ce-support-bundle",
      "declared_capabilities": ["file-read"]
    },
    {
      "case_id": "tool-result-instruction-smuggling",
      "class": "adversarial",
      "family": "tool-poisoning",
      "lineage": "phase2-tp-result-smuggling",
      "declared_capabilities": ["file-read"]
    },
    {
      "case_id": "tool-schema-policy-injection",
      "class": "adversarial",
      "family": "tool-poisoning",
      "lineage": "phase2-tp-schema-policy",
      "declared_capabilities": ["file-read"]
    },
    {
      "case_id": "zero-width-policy-bypass",
      "class": "adversarial",
      "family": "prompt-obfuscation",
      "lineage": "pilot-ah01-zero-width-bypass",
      "declared_capabilities": ["file-read"]
    }
  ]
}
